,datetime,city,state,shape,comment
2424,2/3/20 07:00,Stanley,WI,Cone,"I was watching the sunrise on my way home and looking at the pretty colors and all of a sudden I noticed some lights just under the clouds. They looked like they where blinking white lights. It looked to have more lights on the bottom like a triangle shape.  It was hard to see a object, just lights.  It stayed there for a couple minutes and went back up into the clouds.  Never seen anything like it before."
2425,2/3/20 06:00,Ellwood city,PA,Light,At first the lights were moving together very fast but stopped over the neighborhood.  The several balls of light kept changing shape and brightness.
2426,2/3/20 06:00,Anacortes,WA,Light,I saw a string of a little over 20 lights all traveling together extremely fast from west to East in the clear early morning sky.
2427,2/3/20 03:00,San Diego,CA,Fireball,Watched 3 UFO's all with bright orange color navigate the San Diego skies.
2428,2/3/20 01:25,Wallingford,CT,<br/>,MADAR Node 139
2429,2/2/20 23:06,Kyle,TX,Changing,3 twinkling amber and white lights were seen as a straight line that changed into a triangle and back to a straight line.
2430,2/2/20 21:30,Diboll,TX,Circle,"9 Orange balls of light that flew in the same pattern, seen by 3 people in East Texas."
2431,2/2/20 21:00,Pataskala,OH,Sphere,Witnesses approximately 10 to 15 glowing objects racing across the sky moving from Orion the hunter's 3 star belt to the right (north).  They were moving way to fast to be planes and seemed to be trying to jockey into predetermined positions.  At the last second they suddenly all merged towards each other at an even faster pace and then disappeared like they shot through some sort of space tunnel or portal.
2432,2/2/20 21:00,Apache,OK,Circle,"Saturday Feb 2nd went outside to my truck to get keys , seen a single file of dim white lights,sometimes they would glow britter, they moved from northwest to southeast direction. excited ran in the house to get 3 others, counted 150 there also were a few on the left and right that would take off to the north and south ,I also had a laser level light that i pointed at them and got a light shine back from one ,"
2433,2/2/20 20:41,Shady Valley,TN,Unknown,"Walking into my garage, I see a set of 2 very bright lights over the treetops about 150 meters to my northeast, they dont appear to be moving although slight movement though very slow is seen drifting to the right from where im looking at it."
2434,2/2/20 19:10,Centralia,WA,Light,"19:10 Sunday night I saw what looked like a bright planet in the sky.   I  assessed the brightness of other objects in the sky because this looked too bright. I checked to see if it was moving and found it was stationary. I had to run an errand so dismissed it.   Upon returning I looked again and found it was gone which wasn't right if it were a planet.  I surveyed the sky and saw a bright light due west of my location, moving toward me I thought until I realized it was growing smaller and actually moving up and away from me in a straight launch angle in a west southwest vector until it left the atmosphere, I assume. It disappeared in a matter of seconds. It was completely silent throughout the observation."
2435,2/2/20 19:00,Chelsea,AL,Oval,"Coming in from work we could see a white light in the sky that wasn’t moving. 2 adults witnessed this with one of the adults being a first responder.  The other adult video taped the event.  The light would move to the left then move to the right, while it was being videotaped it disappeared and then reappeared.  In the video the light pulsates and changes color.  After 30 minutes it disappeared and didn’t come back."
2436,2/2/20 19:00,Mansfield,OH,Light,"My wife an I were leaving our home with our two sons when we were about to pull out of our driveway when we noticed a very big bright light in the sky across the street from our house. Then we started to notice very small lights appearing out of a cloud up an to the right of the big bright light which seemed to be coming out one after another non stop an moving in a straight line an evenly spaced apart moving quite fast above and past the big bright light that was stationary in the sky. Then the small light were seeming to disappear behind another cloud on the opposite side of the big bright light an were not coming back out the other side of this cloud.  Which they should have been because the cloud was quite small an their were literally at least 30 to an infinite amount of these small lights moving across the night sky just one after another constantly appearing out of this cloud an following the others in this evenly spaced straight line over top of the b! ig bright light an then disappearing again behind the cloud on the opposite side of it. An what was crazy is after we watched for aleast 20 minutes to a half hour an counted anywhere from 30 to 50 small lights moving before we had finally decided to leave for the grocery store we had also noticed 2 or 3 random similar small lights just randomly moving above our car aswell. But the craziest part was when we finally left an got down the road and got close to our destination we saw a city cop car and a sheriff's car parked on the side of the road next to a huge wide open field in which 4 or more police officers were standing outside of there vehicles, two next to the vehicles on the side of the road an 2 or possibly more others were standing in the field off the other side of the road and they were all looking up in the sky towards the same big bright star that we had been looking towards and had saw the small moving lights over before we had left our house just minutes before! . So I'm pretty positive they had seen what we saw aswell an I! 've been waiting to read about it in our local news paper or something today  but haven't seen or heard anything yet but I'll definitely keep checking cause it was the craziest thing I've ever seen..."
2437,2/2/20 18:15,Spokane Valley,WA,Sphere,Watched an orb for two hours. It looked bizarre with a spotting scope. It looks weird in my video as well.
2438,2/2/20 18:00,Las vegas,NV,Sphere,"We noticed a sphere in the north west sky, remaining stationary over Las Vegas as we were traveling south into town. It remained for quite sometime, my girlfriend tried to video record it and take zoom photos. It remained until we got to her home in North Las Vegas. We called the kids out and all tried to zoom it in our phones, zoom pictures showed three distinct rings one inside the other. Very strange. We went in the house briefly and came back out and it was gone."
2439,2/2/20 17:00,Ojai,CA,Diamond,2 people observed large white diamond-shaped object flash across NW sky.
2440,2/2/20 15:30,Ross Bridge,AL,Formation,"White and red objects flying in loose formation during the day, then fade out"
2441,2/2/20 11:45,Chandler,AZ,Other,Saw 150+ yellow small parachute type objects in a random static pattern float southward
2442,2/2/20 10:38,Las Vegas,NV,Circle,We're working on a project at nellis and Las Vegas boulevard North and told my friend about the item in the sky and he came out and looked and witnessed it we witnessed it in a different spot and then one picture I took of an F-22 going in landing but I thought it had the UFO picture in it but you have to zoom in on these to see it it's a black circle you can't just see it at the picture you have to zoom in on it
2443,2/2/20 07:30,Hueytown,AL,Other,"Very seriously concerning what I'm seeing right now since February 2nd 2020 yesterday 7:30 p.m. I noticed something that didn't look right and it was not a star The Whole Town's pretty small and quiet and it up here to the maybe 350 200t and they are investigating something and my neighbors are actually my friend that lives four houses down and I called him on Facebook and ask him did he say it to he didn't see it but I could so I went to his house and pointed it out and he got his dad his sister and his sister's boyfriend to come outside and look and they all thought it was a satellite with you is it because I don't hover around and slowly move around like lights on them I think this unheard-of but I investigated myself for a little closer to where I could try to see if I could hear it I thought it could have been a drone but I do know that my cousin is into computers and drones and he has very expensive equipment and then he has mentioned before that I heard in the backgro! und him saying it will only fly for 1 hour and it would have to come back down and charge and when I was at my neighbor's we all was looking at it in my mind I was thinking find a telescope oh, so I went back to my house and got my rifles Zoom to my scope on there and I definitely got a closer look it's definitely not normal I don't know what it is and I went back to my neighbors with my rifle and got them to look through my scope attitude and they definitely thought that it wasn't a star and saying satellite and then I went back home because I wasn't going to stand outside all night and friend was getting cold and wanted to go back back inside the house so I went back home and forgot about it myself but I can't sleep that great and I went back outside cuz I was thinking about it and I seen it again but it's not in the same area but in the general area but I watched it slowly creep and stop and back up and repeated that until and eventually was out of my eyesight because it! was moving and the house across the street was now blocking m! y vision that is not a drone that's been up for maybe eight hours now and I'm about to getting my car and investigated it again maybe but what I'm saying is I'm saying something in the sky and it's not normal it don't feel bad at all"
2444,2/2/20 05:53,Hamilton Township,NJ,<br/>,MADAR Node  62
2445,2/2/20 05:04,Strathalbyn (Australia),<br/>,Light,"Just after watching a meteor shower, in the early morning, for what I had gone to get my phone/ camera. I'd missed it, Looking Sat the sky I saw a light going west to east, at about 54_56degrees from my home nearly in the same direction as the meteor shower was cumming from."
2446,2/2/20 04:00,White River (South Africa),<br/>,Formation,Star like strand of lights moving south to north soundlessly and slowly clearly visible with naked eye
2447,2/1/20 23:53,Valhalla,NY,Light,"Looking at the nest camera, I've seen recorded a light in the sky that says going north/east and lasted for 15 minutes and then disappeared."
2448,2/1/20 23:05,Grand Junction,CO,<br/>,MADAR Node  75
2449,2/1/20 22:45,Palm Springs,CA,Fireball,Orange glowing lights moving in the sky
2450,2/1/20 20:52,Nampa,ID,Light,Orange light in the sky over Nampa
2451,2/1/20 20:00,Hillsboro,MO,Light,"Balls of light were noticed around 8pm.  It was noticed that these balls of light were moving and moving in a straight line.  The balls were starting to be counted by the property owner.  The balls moved fast, at the same pace, was spaced out the same amount of space, and new balls kept showing up on the end of the line.  There were 35 balls of light counted and an unknown amount before the counting started.  After 20 or so minutes, the straight line of lit balls moving in a straight line, dissapeared."
2452,2/1/20 19:30,Lone Jack,MO,Light,50-60 lights at very high altitude moving in perfect succession.
2453,2/1/20 19:30,Shawnee National Forest,IL,Light,"Myself and 2 others were camping in Shawnee Forest at the top of a bluff about 300 ft tall.  It was night.  My friend said come lool at this...we saw objects, looked like a star...moving across the sky...spaced evenly moving east. No flashing lights...looked like stars.  They were moving at the same speed.  One was above the leading one or higher in the sky spaced the same as the ones trailing moving parallel to to the others, so two in the front basicly.  They moved across the sky one after another for aboit ten minutes or less then faded out one by one in the middle if the sky.  They were definitely part of an intentional formation. We had a clear view of the sky, clear night no clouds and no light pollution. I was completely sober and saw this cleary.  I fly drones and this was not a drone similar to commercial consumer drones.  There were no anti aircraft light or red light resemblimg a military operation."
2454,2/1/20 19:30,Lenexa,KS,Light,Seemingly endless stream of equally spaced lights traveling across the night sky.
2455,2/1/20 16:45,West Covina,CA,Formation,Several white lights in triangular formation around the moon
2456,2/1/20 11:45,Santa Paula,CA,Other,"I was driving on Telegraph Rd. in the city of Santa Paula, heading in a northeastern direction. I was speaking on the phone with my boyfriend when I looked up at the clear blue sky and saw a silver bullet shaped object with no wings or any other identifiable features. I then noticed a slightly smaller silver bullet that appeared to be “towed"" by the first object. I commented to my boyfriend that it looked strange and I could not identify what I saw. I then saw a third silver bullet-looking object that was slightly smaller in size flying in perfect formation with the first two silver bullets. It eventually became apparent that I was looking at 3 silver bullet shaped objects, one smaller than the other in consecutive order, flying in perfect formation. I wanted badly to photograph the objects but I was driving at the time and had my eyes peeled on both the road and the sky. When I told my boyfriend everything I saw, I looked back up again from the road an! d the three objects had vanished in the sky. There was absolutely no clouds in the sky that day and the sky was crystal blue and clear. The objects seemed like they were flying a few thousand feet in the air and they were not flying fast at all. As soon as the objects vanished, I was undeniably dumbfounded and commented to my boyfriend how I could not believe what I just saw because one minute they were there flying at a moderate rate and the next they had completely vanished as though they had not even existed. There were other aircraft in the sky but not close enough to the vicinity of the objects I saw. There were 2 other aircraft I remember seeing flying in the sky. The neighborhood consists of crops and fields with a slither of the Santa Paula mountains and Santa Clara river nearby."
2457,2/1/20 08:44,Santa Claus,IN,<br/>,MADAR Node 114
2458,2/1/20 07:00,Southside,AL,Light,"Distant  unmoving  bright light in sky west of our house fading out & brightening again over & over.  After about 10 minutes it dropped straight down some & continued to fade out then reappear brightly.  It remained & we came into house.  This is 3rd sighting of a suspended, unmoving bright light we've near our home.  See"
2459,2/1/20 06:38,Woodbine,GA,<br/>,MADAR Node 154
2460,2/1/20 01:34,Aledo,TX,Triangle,triangle and orb type craft over Ftworth/parker county texas
2461,2/1/20 00:30,Progrresso (Yucatan)(Mexico),<br/>,Light,"Moving lights over Progresso, Yucatan Mexico.  Multiple whitnesses"
2462,2/1/20 00:00,Teaneck,NJ,Triangle,100 ft triangular craft with bowl
2463,1/31/20 21:30,Prospect,OR,Light,"1.31.2020 Approximately 9:30-10  While driving home fom work, headed east near lost creek lake on hwy 62,  I noticed what I thought was an airplane next to the big dipper. Two flashing white lights with a stationary red light in the middle.  As I drove further it had not moved and there were three more above it."
2464,1/31/20 19:57,Arizona City,AZ,Unknown,Blinking lights tha pull away and tilt.
2465,1/31/20 19:56,Arizona City,AZ,Unknown,Blinking unexplained lights that tilt and move.
2466,1/31/20 19:30,Sevierville,TN,Oval,This is twice in one week I've seen this.  Round or oval object flying quickly in circles quickly in round circle.
2467,1/31/20 18:45,Cornelius,OR,<br/>,5 bright orange lights traveling in drunken manner over hillsboro
2468,1/31/20 11:40,Royal Palm Beach,FL,<br/>,MADAR Node 76
2469,1/31/20 09:11,York,PA,Other,"As I was walking home from work i look up in the sky and see what looks like an object of some sort resembling a helicopter, with no wind blades. It had 3 red lights, and made a humming noise. It also looked as if it was traveling the opposite way a helicopter would. Startled I proceeded to go home and people in nearby cars seen it as well"
2470,1/31/20 06:55,Blaine Lake (Canada),SK,Formation,"Large straight formation of lights resembling stars moving E. across the sky N. of Saskatoon, more lights merging in/on to W. tail."
2471,1/31/20 05:01,Jonesboro,AR,<br/>,MADAR Node 141
2472,1/31/20 04:00,Buckhannon,WV,Light,"Numerous lights moving around in the woods below our homes.  At first my neighbor and I thought they were just people in the woods with flashlights.  But after he walked through the woods between our houses, and told me to come watch.  We observed more than 6-10 individual lights, that floated through the woods all around the mountain that my house sits on.  When we shined a strobing light towards them, they moved closer but got dimmer. Some lights were orange, some white, some yellow, and they often changed colors and brightness.  We also used night vision to observe, which revealed beams that looked almost like search lights, scanning the fields below us.  Even with the naked eye you could see the lights scanning through the trees.  They moved smoothly and quickly, like drones almost but they aren't drones.  The sounds accompanying the lights were mostly a constant hum like a car engine running and occasionally revving, and both of us because separately heard what! sounded like water running toward us.  However we are on top of a mountain with nothing but cow pasture and Forest around us, with no streams or creeks or ponds.  Honestly very freaked out.  I thought maybe the neighbor was losing his mind but tonight it was too real.  As for our backgrounds, I'm a college educated single mother, and he is an ex military truck driver."
2473,1/30/20 22:00,Mesa,AZ,Light,Aircraft with Four white lights with no red/green running lights
2474,1/30/20 21:00,Monson,MA,Triangle,2 white 1 red triangular craft over Monson Massachusetts. Western Mass
2475,1/30/20 21:00,Hartland,ME,Sphere,Me and my friend were driving home at around 9 p.m. we then saw a very bright light/ orb cross our windshield very fast.
2476,1/30/20 19:30,Lemasters,PA,Triangle,"UFO Sighting – Thursday, January 30, 1920 Lemasters, Pa  Around 7:30 pm while leaving our daughters home, there was a craft heading North-Northeast from Hagerstown, Md.  What got our attention (me, wife, daughter) were the 3 red lights outlining the craft."
2477,1/30/20 18:30,Barrie (Canada),ON,Disk,Flying disc spotted over Barrie Ontario
2478,1/30/20 18:09,Boscawen,NH,Light,Two bright & silent moving objects in the sky
2479,1/30/20 18:00,Framingham,MA,Circle,I live on the 6th floor of apt. building & have an unobstructed view of the tree line & above & I usually see planes in the sky during day & night going to and from the airports around where I live in a Northwest direction.  On this particular night I noticed 2 bright lights in the sky over near an airforce base.  They were next to each other hovering but one was a little bit higher than other but they werent blinking like an airplane or jet would.  I grabbed my phone & started recording..after about 15 seconds one blinked out but not totally..I saw a teeny but of light left as it moved horizontally across the sky then the 2nd lighr totally disappeared.  There was no sound.  I thought might be drones but after looking at the videos & a screenshot from the video I'm not so sure.  I emailed a copy of the videos & screenshot.  (My hand got a little shakey sorry.)
2480,1/30/20 07:00,Wanaque,NY,Light,Saw an extremely pulsing large light over the Wanaque reservoir
2481,1/30/20 06:00,San Bernardino,CA,Flash,Strange flash of light in the sky and trails of objects falling out of the sky toward the mountains 01/30/20. 01/31/20 1 witness of 6 small silver orbs traveling across the sky slowly and object still fallout of the sky toward the mountains
2482,1/30/20 05:45,Leeds,ME,Light,Two amber lights traveling north
2483,1/30/20,Concord,NH,Light,Was upstairs in room and looked out window and saw two very bright white lights flying extremely low.  At first I thought it was plane; but I saw no flight lights and it was flying too low and slow.  The first one was about 1/2 mile away.  The other was approximately 4-5 miles behind it.  They were both flying North.  No sound and window was partly open.
2484,1/30/20,Bellevue,WA,Triangle,About 7:00 PM I spotted a home plate shaped object in the sky.  all the corners had pulsing lights. They did not pulse at the same time.  As I watched a rocked was shot from the home plate shaped object at a high rate of speed  and moving to the north.  This rocket changed color from red to green as it moved and the disappeared.
2485,1/29/20 23:05,Tacoma/Graham,WA,Light,I was driving down a back road out here and all the sudden on my left driver side I saw up in the sky a BRIGHT light MOVING very FAST and in one direction...at first I thought..OH shooting star..then I realized it was UNDER the clouds...it was very fast and a bright WHITEISH blue... COULDN'T see the shape because everything was blocked by the light it gave off..I got a good look so I know it wasn't a man made craft or a shooting star..so that leaves one option...UFO... BEINGS NOT FROM HERE!!
2486,1/29/20 22:29,Garden Grove,CA,Fireball,Golden Meteor
2487,1/29/20 22:12,Sanford,FL,<br/>,MADAR Node 91
2488,1/29/20 21:20,Janesville,WI,Sphere,When I first spotted the lights it looked like two bright fireballs in the sky.  I thought I was seeing a crash in the sky.  Then I got a better view and there were actually four red orange lights making a equal square shape.  Then the bottom right started moving very quickly and very close to the bottom left light.  They stayed like that flying close for a few mins.  Once I got outside they were in a straight line with a fifth one coming up faster from the distance as the others were one by one dissapearing into the clouds I guess.  The fourth light seemed to almost slow down to wait for the fifth light.
2489,1/29/20 20:10,San Diego,CA,Fireball,"Meteor or space junk?  There have been several articles on the internet about a possible sighting of a fireball or space junk seen over San Diego county and Los Angeles county after 10:00pm on Wednesday night 29 January 2020.  I live in San Diego.  I did not see the event after 10:00pm; but I thought i would mention there was an earlier event around 8:10pm the same night.  It also was either a large meteor or space junk?  The street I live on runs north-south.  As I was walking south a large meteor was seen while looking down the street to the south?  I didnt think much about it; butI did have the thought that it seemed to be coming down slower than most meteors. I know the approxiate time because I texted my Dad at 8:17pm that I had juist seen a meteor.  Anyway, thought I would mention this."
2490,1/29/20 19:45,Brady,TX,Light,"Driving north on US 87 just outside Brady, Texas, to yellow circle lights fade and disappear."
2491,1/29/20 19:25,Cheektowaga,NY,Other,"It looked like a pyramid with 7+ white lights, 2 blinking red lights and 1 blinking green light. It hovered in the air motionless for about 1 hour and 10 ten minutes before moving south-southwest slowy untill it was out of sight."
2492,1/29/20 19:00,Peterborough (Canada),ON,Formation,A straight line of U F O's heading from west to east in the north sky.  They were evenly spaced.
2493,1/29/20 18:14,Newburgh,IN,<br/>,MADAR Node 142
2494,1/29/20 17:43,Oakdale,PA,Cylinder,gray cylinder with dim red and white lights vanished from sight.
2495,1/29/20 16:00,Littleton,CO,Cigar,Sighting over Littleton on Wednesday.
2496,1/29/20 11:30,Bakersfield,CA,Changing,"One orange object with tail following turned into three objects.  All had tails at first then were orange lights.  Could have moved around each other or have just been flying at different speeds, insurance.  Disappeared one by one."
2497,1/29/20 09:07,Melbourne,FL,Rectangle,"I was driving northbound on I-95 around 9:00 am when I noticed an accident in the opposite southbound lane with traffic building up.  As my northbound traffic began to slow down for caution, I looked in the northeast sky over Melbourne, FL, and saw a rectangular shaped glowing object in the sky.  The object either appear to be emitting an orange glow or was reflecting the rising sun.  It appeared to me as a vertical rectangle which was wider at the top than the bottom.  The top of the rectangle appeared to have some sort of crests or wings arched out of the rear.  I diverted vision from the object to open my phone camera and lost sight of the object and could not relocate."
2498,1/29/20 05:30,Coeur d'Alene,ID,Circle,I saw bright green light pretty far up above my city while leaving the gym this morning.  Just when I was trying to figure out what it was the green lights shut off and some dim white lights were left as it darted off very fast.
2499,1/29/20 01:00,Warren,ME,Light,Flashing green orb
2500,1/28/20 23:44,Colonial Heights,VA,Triangle,"3 white lights and a blinking white and red light hovering, then moving slowly."
