,datetime,city,state,shape,comment
1531,3/10/20 18:10,Orem,UT,Rectangle,"Driving into Timpanogas Trailer Park, and all of the sudden I saw 4 main white focal points creating a Rectangle pirimeter around dark space.  Then all the sudden I saw a doorish shape ""materialize"" out of redish Amber little dots in the middle of the dark space.  Then it went out of view."
1532,3/10/20 17:29,Chandler,OK,Circle,Small slow white ufo
1533,3/10/20 08:54,Santa Fe,NM,<br/>,MADAR Node 78
1534,3/10/20 08:45,Lawrenceville,GA,Unknown,Stationery Rumbling in Sky for 10 minutes.  Not a plane or helicopter.
1535,3/10/20 06:40,Isle of Man (UK/England),<br/>,Other,Bright star looking object size of basketball moves across hill/field dissappers in copse of trees
1536,3/10/20,Commerce,GA,Sphere,Giant white light sphere seen hovering for 45 min
1537,3/9/20 23:37,Aliquippa,PA,<br/>,MADAR Node  68
1538,3/9/20 23:25,Kennett Square,PA,Sphere,At approx. 11:25 pm witnessed large ball of light rotating as it seemed above the trees at a distance of about a mile I seen it from my apt window facing south toward Delaware It had no path of movement of any kind except of what appeared to be rotation it had a dark ring around it that gave the appearance of it spinning watched it till it faded out of sight
1539,3/9/20 21:09,Glendale,AZ,Flash,"Approximately at nine o'clock pm, we were travelling east on Oraibi and saw a two blinking, white lights side by side.  My mom and I pulled over and I began to record the event. Another couple of blinking lights came from the south at the same time another blinking light came from the east, they then synchronized and continued to travel west, following the first two lights.  We watched them until they were out of sight."
1540,3/9/20 20:45,Hat Creek,CA,Triangle,"On March 9, 2020, at approx 8:45 PM I was traveling on California Hwy 89 near Hat Creek CA when I observed a bright light in the sky to my West, it was much brighter than anything else in the sky and it intrigue me as to what it may have been so I attempted to record a video of it using my Samsung Galaxy S9 Cell Phone."
1541,3/9/20 20:10,Detroit Lakes,MN,Circle,"When looking at sirus as it was the brightest star in the sky, I noticed one after another, a hand span behind each other in a staight line.  My friend from Brainerd called me and was seeing the same thing many miles away.  Another friend saw it at the same time in Indiana! A literal ring around the mid west!"
1542,3/9/20 20:04,Glendale,AZ,Flash,"Flashing white lights, aligning them moving 2 side by side and following the other flashing line of lights."
1543,3/9/20 20:00,Ellington,CT,Oval,Driving on West Road saw a stationary craft in the sky above me with at least 3 lights too close to me to be a plane and not moving.  It seemed like a sparkly thing was coming down slowly from it like a slow moving pin of light toward my car and i stopped my car and said to myself what is that? Got scared and wanted to keep moving...
1544,3/9/20 19:51,Wichita,ME,<br/>,MADAR Node 123
1545,3/9/20 19:15,Martinsville,NJ,Light,Bright light above the southwest horizon like a star but too low to be a star. Hovering but occassionally moving in an erratic way from side to side yet remaining in the same general location. Didn't seem to be making any noise.
1546,3/9/20 18:55,Chennai,IN,Circle,"When the event occurs Am back from office break to floor, as usual i look up on sky to seen brighter of moon as it was a super moon. Suddenly a star shape object passes very fastly on sky, when am looking it crosses Orion star cluster and keep on moving, I never seen an object moving that fast on sky, I knew it's not a flight or some other man made machine,because object moves very fast just mind blowing. Am sure with in a minute it would has crossed more than 150kms. I do no what is the object is. It's circle in shape and looks as brighter as star."
1547,3/9/20 17:10,Cambridge,OH,<br/>,MADAR Node 137
1548,3/9/20 16:33,Watsonville,CA,<br/>,MADAR Node 105
1549,3/9/20 10:47,Jericho,VT,Circle,"My girlfriend and I saw a ball of bright light making some impossible maneuvers for at least 5 min,looked away for 1 sec and it’s gone."
1550,3/9/20 06:40,Issaquah,WA,Light,Slow moving white light going over.my building
1551,3/9/20 01:35,North Augusta,SC,Light,"Far-off light zigzags rapidly over the treeline, multiplies into up to six lights"
1552,3/9/20 01:30,Wilmington,NC,Light,"Sighted one bright low-flying light slowly glide up and abruptly stop. originally guessed it might have been a helicopter or osprey out of lejeune or new river but there was no noise and the flight pattern was too tight and in my opinion, impossible for conventional aircraft. Not long after it stopped and began to hover, a second smaller light appeared to almost morph out of the bottom of the craft almost like a bead of liquid dripping off.  The second object rotated around the larger original object several times while the original object pulsates with light, then (almost as if it were called back) the second object quickly emerged back with the original and the object took off in the opposite direction on a linear horizontal flight path.  Again there was never any noise and these objects were in my opinion within a half a mile of where I was as it was visible to me in my perspective."
1553,3/9/20 01:00,Paris,KY,Circle,Circular shape lights all around.
1554,3/8/20 23:57,Palm Harbor,FL,Sphere,Looked out my third-floor balcony to see a large round orange light slowly moving east.  It continued east and then vanished.
1555,3/8/20 23:24,Kastl (Germany),<br/>,Unknown,Bright lights over Germany
1556,3/8/20 23:00,New York City,PA,Circle,Disappearing dot of light
1557,3/8/20 23:00,Rochester,NY,Diamond,"Me and my friends were chilling outside in our front yard at night time around 23:00 hours.  As we looked up at the sky, we seen a triangular shaped object flying in the sky just off route 104.  We were in the town of Ontario, NY.  The unknown object then did a circular turn and changed lights and speed.  We were all shocked and nervous when we saw this.  We didn't know who to call.  The object then projected a beam of white light and then it vanished.  We waited outside longer to see if it would reappear and it did.  This time it was two of them."
1558,3/8/20 21:00,Niles,OH,Light,Saw 4 lights looked like dim stars.  All in a line spaced evenly apart too high to be airplanes no typical flashing lights associated with airplanes.  Traveling fast from west to east and disappearing as they came overhead.  All following in line disappearing each at the same point.
1559,3/8/20 21:00,Charlotte,NC,<br/>,"Double or triple bright lights, not moving, just side by side/ clustered for several minutes"
1560,3/8/20 20:00,Lancaster,PA,Sphere,Red/Orange Orbs Observed in Cabbage Hill
1561,3/8/20 20:00,Solon,ME,Changing,Red on Horizon propels itself forward white flash and disappears.  High elevation when seen from my computer.Did it Land?
1562,3/8/20 19:45,Los Angeles,CA,Fireball,"Four orange/yellow fireballs were seen off in the distance as planes were descending nearby.  Slowly, 2 of them faded out like a shooting star.  Then a new fireball appeared. And the remainder left eventually faded out in the same way."
1563,3/8/20 19:00,Parrottsville,TN,Light,My son came and got me said wow look at this we went out and it look like a planer something wrecking and then so I get stopped went sideways and you could see it for a few more minutes and it was going but then there was another one he got only a few seconds video in all honesty I don't believe in that but I did tonight I really thought of the movie Independence day I know that sounds silly I'm a 42 year old woman I'm not pranking but it was so cool it was the weirdest thing I've ever seen the way it moved and then disappeared
1564,3/8/20 18:41,Rochester,MI,Teardrop,Unusual aircraft captured by video
1565,3/8/20 18:31,Valley City,ND,<br/>,MADAR Node  93
1566,3/8/20 15:46,Thoubal (India),<br/>,Triangle,A black kite like object hovered above me and disappeared within some seconds.
1567,3/8/20 15:30,Oxnard,CA,Changing,Morphing UFO from airplane/tic tac shape to suspended triangular shape over ocean using electromagnetic waves
1568,3/8/20 10:59,Woodbine,GA,<br/>,MADAR Node 154
1569,3/8/20 09:45,Canton,MI,Triangle,TRIANGLE SHAPE HOVER SLOW
1570,3/8/20 08:23,Littlerock,CA,<br/>,MADAR Node  56
1571,3/8/20 06:15,Corpus Christi,TX,Formation,32 obects over the south Texas sky.
1572,3/8/20 05:31,Aliquippa,PA,<br/>,MADAR Node  68
1573,3/8/20 05:00,London (UK/England),<br/>,<br/>,"Seen moving 'stars' all moving in the same direction, similar speed, same path across the sky."
1574,3/8/20 04:47,Valley City,ND,<br/>,MADAR Node 93
1575,3/8/20 02:45,Medford,OR,Changing,"A black object emitting a blue light was seen.  It was roundish but changed shape.  It flew above and below the clouds and circled the area.  It might be a drone however it flew high above the clouds and disappeared going north from Medford, Or."
1576,3/8/20 00:00,Fort Lauderdale,FL,Rectangle,"Huge ship splits in 2,,, FT LAUDERDALE"
1577,3/7/20 22:50,East Hartford,CT,Other,"Saw a very bright light in the sky which then faded and revealed the shape of  the craft. It looked similar to a helicopter and was extremely low, but it definitely was not a helicopter and didn’t have propellers. It seemed like it noticed us watching it and after being slow, it went away very fast at least a few miles away. Rolled down the car windows and it made a faint humming sound."
1578,3/7/20 21:47,Woodbine,GA,<br/>,MADAR Node 154
1579,3/7/20 21:30,Sanbornton,NH,Light,Flickering light hovering over tree line
1580,3/7/20 21:00,Carmichael,CA,Circle,Unknown flying craft circle in shape and dark grey ship approx. 40’ in diameter.
1581,3/7/20 20:47,Woodbine,GA,<br/>,MADAR Node 154
1582,3/7/20 20:45,St. Johns,MI,Light,"6 lights in the sky, 5 white and the 6th pulsed red and white, St. Johns, MI"
1583,3/7/20 20:30,Fargo,ND,Light,Multiple lights flying across the night sky.
1584,3/7/20 20:15,Moon Township,PA,Changing,Large blue light emmiting orb that split into severle smaller ones
1585,3/7/20 20:00,St. Cloud,MN,Light,Moving lights in Minnesota sky disappearing into what appeared to be a trail of smoke.
1586,3/7/20 20:00,St. Cloud,MN,Unknown,10 aircraft in evenly spaced linear formation.
1587,3/7/20 20:00,Sauk Rapids,MN,Light,"I saw about 30 satellites moving in single file, straight line trajectory, constant speed, spaced evenly apart"
1588,3/7/20 20:00,Madison,OH,Formation,11 lights traveling in a straight line very high up perfect spacing and speed in a single file.
1589,3/7/20 19:45,Cheboygan,MI,Light,Lights on parade
1590,3/7/20 19:45,Clarendon,NY,Formation,I looked up into sky after returning home late from work and looked up into the sky. I saw a long formation of craft sequentially appearing equally spaced in a straight line appearing at like 70 degrees and disappearing at 85 degrees. I don't know how long this was going on before I noticed it.
1591,3/7/20 19:40,Poynette,WI,Light,Multiple lights traveling in a straight line.
1592,3/7/20 19:35,Butler,PA,Light,Its a clear night i seen 9 lights moving in a straight line same distance apart and same speed
1593,3/7/20 19:30,Columbus,OH,Light,"40-50 solid lights going from West to east at equal intervals for about 10 min from when I noticed them. Then they disappeared. They were not easy to spot, they seemed really far no sound."
1594,3/7/20 19:30,La Grange,KY,Light,"Numerous balls of white, and some red lights slowly moving in and around other and other stationary lights."
1595,3/7/20 19:30,Fremont,OH,Light,10 very high white lights in a single file formation 8 to 10 degrees apart.
1596,3/7/20 19:30,Delaware,OH,Formation,At 7:30pm I was in my back yard and looked up at the stars as I often do.  I noticed what I thought was the ISS.  So I checked my ISS tracker app.  The ISS was over Asia at that time. So I looked up again and saw two more.  They were traveling from west to northeast across the night sky.  There was a total of 3.  They were white in my binoculars.  They were moving at a constant speed and all three were equidistant from one another. They did not blink or pulse and had no green or red lights.  Why would three satellites travel in formation?  This is odd to me.
1597,3/7/20 19:30,Powell,OH,Light,A line of at least 7 points of light moving from southwest to northeast over Ohio 1930 hrs 3-7-2020
1598,3/7/20 19:30,Huber Heights,OH,Unknown,"11-12 Fast Flying Objects over Dayton, Ohio Suburb"
1599,3/7/20 19:02,Summerset,SD,Formation,25-30 white lights flying in a straight line equally spaced apart.
1600,3/7/20 19:00,Glenview,IL,Cross,"20+ drones, same make and model, night flying in a staggered loop with no definite point of origin."
1601,3/7/20 19:00,Clinton Township,MI,Light,AN EVENING THAT CHANGED MY LIFE.
1602,3/7/20 18:57,Rochester,NY,Fireball,Look it like a fireball going up with an aura or flame outline but it was not moving
1603,3/7/20 18:30,Davisville,WV,Light,Same as above.
1604,3/7/20 15:36,Whidbey Island,WA,<br/>,MADAR Node  58
1605,3/7/20 11:22,Edmonds,WA,<br/>,MADAR Node 61
1606,3/7/20 05:38,Valley City,ND,<br/>,MADAR Node  93
1607,3/7/20 02:34,Alice,TX,Sphere,Orange ball of light floating very close to ground
1608,3/7/20 01:00,Port Charlotte,OH,Light,My husband and I were  passengers in a car returning home from late night flight.  He points out strange light in sky to east of I-75 (inland FL).  Observed glowing ball of light In night sky.  This was clearly not as distant as a star because we saw the ball expanding then condensing multiple times.  The shape-shifting gave the ball a certain ‘aura’ or halo effect.
1609,3/7/20 00:30,Callahan (Bahamas),<br/>,Cigar,Driving down Lem Turner Rd just past 12:30am going toward airport saw a bright orange cigar shaped light no flashing just solid reddish orange light in cigar shape tilted top to left maybe 10 to 15 degrees top to right appeared not to be moving as road turned and bent object got blocked by trees drove about one and half mins till had good view again tilted orange oblong was gone but big white smoke half circle shape was left night sky was dark but could see the white smoke good against black back ground of night sky like a big engine took off and left white smoke behind now there was what looked like 3 small lights around white smoke not sure may have been stars may have been something else the whole thing was only couple minutes and when we stopped driving trying to see orange light thing it looked like it would've been over airport smoke looked over airport
1610,3/6/20 23:57,Brooksville,FL,Circle,"We saw three hovering objects sounded in bright red light, they separated and disappeared."
1611,3/6/20 23:00,Atlas,PA,Sphere,"Small, blue red flashing lights,,fades nf disappeared then came back"
1612,3/6/20 22:15,Portal,GA,Sphere,"Solid white sphere seen over Hwy 80.  Then 2 lights seen over Portal.  30 minutes later traveling in the other direction near Hopeulikit there were 4 lights hovering a few hundred yards up, lighting up and going dark intermittently and zig zagging lightly before disappearing."
1613,3/6/20 22:00,Fort Atkinson,WI,Unknown,20 Flying lights disappearing
1614,3/6/20 21:30,Princeton,MN,Other,"At first it just looked like stars in the sky, then on closer observation it was a parade of moving star like shapes moving from the SW to NE evenly spaced apart as they moved. Then there where others that where grouped together, then moved at a faster rate then the others circling the ones in the line."
1615,3/6/20 21:15,Lincoln Park,MI,Light,Unusual rotating lights in the night sky.
1616,3/6/20 21:00,Springfield,IL,Light,White balls of light Springfield Illinois
1617,3/6/20 21:00,Bonduel/Pulaski,WI,Diamond,"Hovering, 1 white light in front 2 red in back, low flying, no sound, unexplainable movements."
1618,3/6/20 21:00,Eagle,ID,Circle,"Mysterious Red/Orange ball of light flew over us in Eagle, ID."
1619,3/6/20 20:30,Saginaw,MI,Circle,There were a line of white lights (maybe bout 9) following one another and then just disappearing in the sky.  It was a clear night and it looked liked they appeared as quickly as they disappeared.
1620,3/6/20 20:30,Traverse City,MI,Formation,"String of *stars* evenly spaced, traveling strait line."
1621,3/6/20 20:30,Fennville,MI,Light,Witnessed a string of lights moving west to east.  They were spaced evenly and seemed to disappear after a good distance
1622,3/6/20 20:23,Grand Junction,CO,<br/>,MADAR Node 75
1623,3/6/20 20:20,Hoback,WY,Light,String of moving sequential lights at high altitude in rural Wyoming
1624,3/6/20 20:15,Omaha,NE,Light,"In evening of 03/06/2020 Omaha Nebraska, Dundee neighborhood @ 8:15 I was out in my backyard to pickup chairs that had blown down during the day.  We had just returned from dinner.  I looked up in the sky as it was a very clear crisp night.  At this time I noticed one non blinking light moving across the sky.  As I followed the light across moving West to East I noticed another duplicate light spaced in line behind it, then another and another.  I called my wife out to witness the lights, she commented it's probably drones and went inside after viewing 4 of the lights in a row."
1625,3/6/20 20:07,Orem,UT,Light,Observed about 20-25 objects that were appearing from the West and heading East and then disappearing into the night sky. They were in a straight line and evenly spaced apart from one another. There were no sounds from the objects.
1626,3/6/20 20:00,Colfax,WI,Light,"I saw 22 or more plane-like lights flying north-east in a straight line, my dogs were acting strange during it."
1627,3/6/20 20:00,Blackfoot,ID,Circle,UFO’s In nighttime sky over Blackfoot
1628,3/6/20 20:00,Junction City,KS,Other,look like stars moving in a row
1629,3/6/20 19:50,Madison,WI,Unknown,Each object was dimly lit and atraveling at a high rate of speed and accenting before each disappeared in the same spot
1630,3/6/20 19:45,Reading,PA,Fireball,25+ orange lighted objects passed in sky (no sound) on 3/6/2020 at 7:45 PM.
1631,3/6/20 19:45,Madison,WI,Light,"Exact distance between &quot;lights&quot;, their speed from each other"
1632,3/6/20 19:43,Olathe,KS,Light,Multiple lights zoom across the sky
1633,3/6/20 19:43,Plymouth,MN,Other,Single file star like sky objects moving across sky in straight line from NE to SW
1634,3/6/20 19:40,Junction City,KS,Light,"My husband and I were pulling into our driveway, when we noticed what we thought was a satellite.  Then another one appeared.  Then another.  Then another.  Then another..etc.  I counted 11 all together.  I ran inside to get my aunt and my husband stopped counting but said they were still coming, and coming.  Strange, they looked like satellites but were in perfect formation, perfectly distanced apart, traveling in a straightline across the sky. Southwest to northeast in direction (towards Manhattan, KS) Lasted at least 5 minutes.  Did anyone else in the area see this???"
1635,3/6/20 19:35,Des Plaines,IL,Flash,"Witness 30 star-like lights, appearing from southwest sky, travelling in &quot;convoy,&quot; evenly spaced, same speed and northeast di"
1636,3/6/20 19:35,Manchester,OK,Light,"Approx. 735 pm, we witnessed a perfect line traveling from south west to northeast direction. There were at least 30 perfect lights in a row, seemed to be traveling quite fast. They traveled in the exact same line pattern in the sky.  It was something I have never witnessed before, they seemed to just disappear into the distance"
1637,3/6/20 19:30,Mount Pleasant,WI,Other,String of 8 to 10 lights that appeared to to have the magnitude of satellites but were evenly spaced.
1638,3/6/20 19:30,Maryville,MO,Light,"Lights Flying high in sky going east northeast, at least 2 times faster than other planes in sky.  All were flying in same path and evenly spaced except for 2 of them were close together, tail one was offset to the side a little.  The sky was bright from moon and the objects went from horizon to horizon and then some."
1639,3/6/20 19:30,Madison,WI,Light,"Similar to some previous reports on here.  Lights moving in a straight line at constant speed, remaining evenly spaced.  When they crossed the Northern cardinal line, they simply disappeared.  I counted seven craft but was in contact with a friend in Brodhead who said he spotted at least 70!  Sattelites, or perhaps something else?"
1640,3/6/20 19:30,Cedar Rapids,IA,Light,"Small lights appeared in the western sky and started moving northeast. The lights were about the same size and brightness as the surrounding stars, smaller than the commerical plane lights that were visibly flashing in close proximity. The lights were not flashing and remained a consistent luminosity with no sound."
1641,3/6/20 19:30,Arvada,CO,<br/>,"Strange formation of lights; Strait line, evenly spaced, seemingly from the same originating point in the sky, one after another."
1642,3/6/20 19:28,Muskego,WI,Light,"Fast traveling light, clearly not a plane, speeding across the sky and then disappeared or flew too distant to see."
1643,3/6/20 19:15,Menomonee Falls,WI,Light,"Looking West at Venus seeing multiple lights over 25 of them moving almost evenly spaced going due East.  One of the light object was a double at about 16 or 17th place.  Objects were very high, higher than aircraft.  Look like moving stars."
1644,3/6/20 19:10,Sun Valley,NV,Light,Western sky under the brightest star lights started to appear one after the other traveling North East all spaced  equally. 14 in total that we seen I filmed 5 or 6.
1645,3/6/20 19:10,Jackson,WI,Unknown,"Looking west at a bright star at about 19:10 last night. I then noticed movement to the right side of the bright star. It was another star,but this star was moving,then came another,and another,they were evenly spaced apart. I counted between 30 to 40 of these things.They moved in a straight formation.When they got to a certain point in the sky they would disappear one by one and only when they got to that one spot in the sky ? These we're not satellites."
1646,3/6/20 19:00,Carson City,NV,Oval,"Between 19:00 to 19:15,15 crafts passed overhead in a steady formation trailing one behind the other with precise spacing coming from the California side of the state headed northeast towards Lyon county. Continuing after 19:15,  a jet crossed in front of the moon which I could hear & see the lights on the plane, then other smaller crafts followed behind the jet headed southeast."
1647,3/6/20 19:00,Edgerton,WI,Light,Unknown string of lights in the sky .
1648,3/6/20 18:00,Baraboo,WI,Circle,Three of us seen a line of circular white looking orbs spaced out evenly at a high altitude traveling at a fast speed (Spacelink?)
1649,3/6/20 17:00,Beavercreek,OH,Other,Flash and object zig-zagging near wpafb
1650,3/6/20 17:00,Madison,WI,Circle,Straight line flight of 8 equally spaced.
1651,3/6/20 15:00,Grass Valley,CA,Light,Amazing straight line of 30+ lights traveling through the sky at a high rate of speed spaced equally going in the same direction
1652,3/6/20 15:00,Port Angeles,WA,Teardrop,Several black objects like a string of beads disappeared .
1653,3/6/20 14:39,Fort collins,CO,Light,Parade or line of star like objects in formation
1654,3/6/20 13:00,El Cajon/La Mesa,CA,Other,It was the middle of the day. I saw 5 metal helmet shaped craft flying in a diagonal upside down L formation right very quickly .
1655,3/6/20 08:45,Jenison,MI,Formation,8 single line lights evenly spaced moving at same slow pace dissappear at the same spot one after the other.
1656,3/6/20 07:45,Rockford,IL,Light,They were in the Northwest sky traveling from West south west to north by North East in single file about 10 miles apart at about 50 degree up from the horizon.  Taking about 30 seconds for each one to cross my part of the sky.  I called my friend in Lee County and they confirmed what I was seeing.  I called my other friend in Rockford he confirm what I was seeing.  We cannot be the only people that saw the lights all in a row about halfway through there was one that was two or three times the size as the rest
1657,3/6/20 07:45,Mequon,WI,Light,String of lights one after another evenly spaced out
1658,3/6/20 07:38,Savanna,IL,Light,Light in the sky hundreds of them ho into what seemed to be a black hole in the sky
1659,3/6/20 07:00,West bend,WI,Formation,White dots in line formation
1660,3/6/20 05:30,Point Mackenzie,AK,Unknown,"I only heard it, it sounded like a jet at a speed close to or exceeding that of the speed of sound"
1661,3/6/20 05:15,Kansas City,MO,Light,"5-6 Sateillite LOOKING objects flying in trail formation maintaining constant speed, heading and distance. NE of Kansas City"
1662,3/6/20 05:10,Branson,MO,Formation,"I took my dogs out early morning and looked to the north, I seen lights moving in a line heading east. They got to a spot directly north and vanished one by one, like if they where landing in something. I seen around 12 to 15 of them in a line formation. It's like when planes come in to land on a carrier."
1663,3/6/20 05:00,Davenport,IA,Formation,"15 to 20 lights, appearing out of the big dipper, traveling south east at even spacing, straight line, then disappearing, one went out of the line and traveled north."
1664,3/6/20 04:36,Hermon,ME,Light,Why so many? There is some mate or volume here!  It was not one observation platform! It was task based..  Somebody should know!
1665,3/5/20 22:00,Ammon,ID,Formation,"24+ lights all synchronized, moving at incredible speed in space. Appearing and disappearing"
1666,3/5/20 21:30,New Orleans,LA,Unknown,Orange Fire Like Orbs Flying Across Mississippi River.
1667,3/5/20 21:15,Lebanon,OH,Sphere,"Round spheres, evenly spaced, heading northwest. Total of 12 lasting 5 minutes. Son in law came outside to witness the remaing 5 before all disappeared. No noise, no trails. Spaced like the dots below."
