,datetime,city,state,shape,comment
719,4/14/20 10:30,Tuscaloosa,AL,Unknown,I was sitting in my car playing poker on my phone when the reception went out.  I got out of the car to move the phone around and a glowing light caught my attention in the sky. When i first seen it it sent an overwhelming feeling through my body and it made me cry.  I couldn't stop looking at it.  Then it started to glow brighter than any star it the sky . Then it disappeared for 5 seconds and reappeared growing brighter each time.  It started to scare me so i called my neighbor over just to make sure i wasn't crazy.  And he said he never seen nothing like it.
720,4/14/20 10:11,Garrettsville,OH,<br/>,MADAR Node 64
721,4/14/20 09:00,Muskogee,OK,Circle,Tons of satellites
722,4/14/20 07:30,Fort Worth,TX,Disk,While amongst the homeless community in Fort Worth Texas. I decided to record and take pictures of the odd looking sky and clouds.  As soon as I started record I noticed and odd shape on the video screen only.  It seem to appear as a glare or light of some sort on my lens or screen.  Turns out neither one was true.  So once I played the video back I noticed the craft and it’s odd movement.
723,4/14/20 06:00,Las Cruces,NM,Light,20 lights moving from NW. to SE.   In chain formation same path evenly spaced.
724,4/14/20 05:45,Alamogordo,NM,Unknown,Spotted 21 points of light flying in identical flightpath in ~45 second intervals.
725,4/14/20 05:45,Las Cruces,NM,Formation,Long train of lights going over las vruces heading towards Mexico. Looked very high altitude
726,4/14/20 05:15,Thousand Oaks,CA,Light,"20+ circular white lights traveling in unison from north to south in predawn night sky, equally distanced, same velocity."
727,4/14/20 05:00,Vancouver,WA,Formation,There were 10 bright white lights evenly spaced apart moving slowly across sky.  There was no sound.
728,4/14/20 05:00,Eugene,OR,Formation,At exactly 5 a.m. I was walking my dog and I was like wow look at the stars and I see these orbs about two football fields apart there was about 35 of them over 10 minutes.
729,4/14/20 05:00,Garrison,CO,Triangle,"At 4 am there was helicopters in the sky flying from west to east.  My husband and I stood and watched as the helicopters Flying in a pattern of 3 helicopters (that I could actually see) one close to my back ya one over top of the hill and another one beside it.  We watched until we could no longer see them. At around 5 am he was backing up, there was a large absolutely silent triangular shaped craft fly from west to East.  The craft came up out hay field at an incredible speed and very close to the ground.  There was a red light on one side green light on the opposite with a large bright white light in the center.  As it came closer to the house, the craft started slowing down and turned on it’s side in a tilt, straightened out and we could see the underneath it looked so big like we could just reach up and touch it.  This lasted only seconds and then it took off over the hill in front of our house in the north.  It seemed so close but it was high enough in the sky to clear the hill and all the trees.  It moved so fast it was gone in seconds and was completely silent."
730,4/14/20 05:00,Garrison,CO,Triangle,"At 4 am there was what we thought were helicopters in the sky flying from west to east.  My husband and I watched a flight pattern of 3 helicopters (that I could actually see) one close to my back yard one over top of the hill and another one beside it.  We watched until we could no longer see them.  At around 5 am he was backing up, there was a large absolutely silent triangular shaped craft fly from East to West.  The craft came up our hay field at an incredible speed and very close to the ground.  There was a red light on one side green light on the opposite with a large bright white light in the center.  As it came closer to the house, the craft started slowing down and turned on it’s side in a tilt, straightened out and we could see the underneath, it looked so big like we could just reach up and touch it.  This lasted only seconds and then it took off over the hill in front of our house in the north.  It seemed so close but it was high enough in the sky to clear the hill and all the trees.  It moved so fast it was gone in seconds and was completely silent.  The craft was so large that I am unable to put it into perspective of the enormous size."
731,4/14/20 05:00,Nanaimo (Canada),BC,Light,A line of what appeared to be stars travelling from NW to SE above Nanaimo. A few went off course but came back to move with the others. The light were quite spaced out. Travelling in groups of 2 or 3.
732,4/14/20 05:00,Vancouver,WA,Formation,There were 10 bright white lights evenly spaced apart moving slowly across sky.  There was no sound.
733,4/14/20 04:50,Oroville,CA,Sphere,objects that looked like stars moving accross the morning sky.
734,4/14/20 04:45,Indore City (India),<br/>,Unknown,Seen a bright spot travelling from west to east
735,4/14/20 04:45,RIO VISTA,CA,Light,Strange objects flying in perfect formation above Rio Vista Ca
736,4/14/20 04:45,Central Point,OR,Circle,No less than 17 satellites all in a single line going from NW to SE.
737,4/14/20 04:35,Carson City,NV,Light,"Strange single file lights traveling from north to south at 4:35 to 5:20 Am over Carson city , NV."
738,4/14/20 04:35,Las Vegas,NV,Light,"2 Parades of satellites, 40 total, west to east across Las Vegas sky"
739,4/14/20 04:24,Northbrook,IL,<br/>,MADAR Node 148
740,4/14/20 04:00,Montebello,CA,Light,Looked up at the sky and immediately noticed all the traffic high in the sky.
741,4/14/20 04:00,Davis,CA,Light,Hundreds of “satellite light” type craft heading inland to Nevada
742,4/14/20 02:45,Powell River (Canada),BC,Light,"fast twinkling light hovering in night sky, colored red. (then poof gone after 10 minutes)"
743,4/14/20 02:30,Kennebunk,ME,Light,Multiple lights following each other
744,4/14/20 02:30,Kennebunk,ME,Light,Multiple lights following each other
745,4/14/20 02:16,Dover,NH,Changing,UFO accompanied by strange weather in Dover New Hampshire
746,4/14/20 00:00,Round Rock,TX,Sphere,Saw a white sphere hovering in front of my truck as I was driving and then disappeared
747,4/13/20 23:30,Pensacola,FL,Unknown,"Craft was moving slowly to the east/SE and appeared to be less than 1,000 feet above me as I could see flames shooting out from underneath as it went directly over my vehicle as I was driving west on Cervantes near Palafox.  Estimated speed of less than 100 mph.  Craft itself had a slight glow from fire propelling it but couldn't see enough to identify shape. Estimated size less than 10 meters diameter based on size of flame diameter."
748,4/13/20 23:00,Brocket (Canada),AB,Circle,"2 large oranges/white balls in sky.  Red, blue, green lights swirling all around.  It would stop and move up and down backwards ."
749,4/13/20 23:00,antalya,<br/>,Light,15 object going to west  in sky.. 15 light only one formation.and very far.look its a star but not star.
750,4/13/20 23:00,Augusta,ME,<br/>,"5 orange lights following in formation but in a methodical way.  All disappeared into a ""black"" part of space.  Almost looked"
751,4/13/20 22:45,Bangalore (India),<br/>,Formation,Flying Birds with lights sighted @ night moving in group in bangalore
752,4/13/20 22:30,Green Bay,WI,Light,"Bright light high in sky, not moving for awhile but moving down slowly and intermittently, different movement from planes we see here."
753,4/13/20 22:30,Flat Rock,NC,Light,I went outside to move my vehicle and noticed an odd bright light .  At first I thought it was a plane waiting to land staying still for clearance but then I remembered the hour and that there are no flight coming in this late here in my town. I  noticed lots of similar bluish color circle lights and some blinking at first I though planes again and was intrigued by the planes that were flying under the radar with no sound.  That’s when it really hit me.  I recorded the light and around it took pictures. and brought my wife out to see it also and she was confused also.  We stood their for a good 3 to 4 minutes then walked in the house after researching online about these sighting .  I went outside again to see if the light was there and there was nothing more the other lights I thought were stars .  Black sky with some planes coming through .
754,4/13/20 22:14,Modesto,CA,Sphere,UFO cluster imaged from ISS
755,4/13/20 22:00,Tullahoma,TN,Circle,I was driving home when I saw a white object in the sky.  At first I didn't think anything about it as helicopters fly in to our local hospital.  However this object flew close to the tree line and was moving really fast.  Was able to snap a few pictures while driving to catch up.  I turned on a road next to a funeral home and saw it suddenly stop in the sky and hover.  I took a video showing it just sitting there in the sky.  Then I got freaked out and drove away.
756,4/13/20 22:00,Whitmire,SC,Light,Clear sky.  Around 15-20 evenly spaced lights that sort of resembled stars. Traveling in unison with one line going  north and the other going south. Eventually they would disappear or seem to fade away. Almost looked as if you could actually some sort of “line” or “path” they were traveling on. Went on for around 8-10 minutes.
757,4/13/20 22:00,Laie,HI,Disk,"Two bright red then orange golden dots/saucers in the sky, shining then dimming encircling each other until their lights went off."
758,4/13/20 22:00,Thousand Oaks,CA,Triangle,"Very large seemingly floating.... multiple flashing lights, my pictures did not capture it, other than a bright light."
759,4/13/20 21:50,Waterbury,CT,Sphere,"Twinkling red,blue,yellow,white light that stayed in the same general part of the sky moving in jerky movements from up down to left and right and sometimes in a loop motion,for about 45 mins."
760,4/13/20 21:35,Powell,TN,Light,Line of lights
761,4/13/20 21:30,Jasper,GA,Sphere,At least 50 to 75 lights in single file formation moving from northwest to southeast.  No sound.  One appeared to zig zag but for the most part they maintained even spacing in a single file line.  There were 2 other strange anomalies - a bright pulse and another craft moving at an extraordinary speed.
762,4/13/20 21:30,Asheville,NC,Formation,"Lineal pattern, sequential, star-like lights seen flying for 15 minutes in Asheville, NC."
763,4/13/20 21:30,Tamassee,SC,Light,"20-30 bright lights, evenly spaced, flying in a row one behind the other, from NW to SE, no sound, no blinking lights"
764,4/13/20 21:15,Phenix City,AL,Light,My husband and I watched over 100 balls of light flight over our home from the northqest towards the south east for more than 20 minutes they were in perfect alignment making a straight line path until they disappeared one by one unto the same place in the sky.  I could still see the stars around where they vanished. They were below the cloud line.  It was unnerving to see so many.
765,4/13/20 21:00,Hartwell,GA,Light,"Saw a line of white lights that looked like stars moving in straight line, counted thirty eight objects with no sound, never seen anything like it"
766,4/13/20 21:00,Douglasville,GA,Light,lights racing across sky in same pattern
767,4/13/20 21:00,Rossville,GA,Light,"We were just sitting outside and noticed shooting stars, several, we counted around twenty. They were going in a strait line from Lookout Mountain area over the city of Rossville.  I would say they were satellites but I am unsure.  At first I thought it could be a meteor shower.  We start watch alot and Venus has been very bright in the night skit this month. It was very cloudy and cold tonight.  We could see then coming from the area Venus is in and going seemingly upward in a strait path.  It just looked like stars moving across the sky.  We called other purple in the area who was seeing the event as well."
768,4/13/20 21:00,West Islip,NY,Light,Fixed Light moved North to south very slowly.
769,4/13/20 21:00,Montville,NJ,Circle,Very bright light. Much larger than a star I took a picture and video.  It appears to have a halo effect around it.  It jumps in and out so I got some good pictures.  It definitely had some colors in the center.  It was only there for 1 hour then moved much further back in the sky.  It always appeared to have a tail that was also a bright light .
770,4/13/20 20:49,Newburgh,IN,<br/>,MADAR Node 142
771,4/13/20 20:40,Ashland City,TN,Formation,"11, non-blinking lights, moving quickly in a single-file line across the sky. All equidistant and following the same trajectory."
772,4/13/20 20:30,Milton,FL,Light,"Milton, Fl.   4/13/20   8:30 P.M. --15 or more white lights moving in single file formation from North to South. Possible military but non-blinking and no noise. Similar to a satellite."
773,4/13/20 20:30,Nashville,TN,Light,We observed lights traveling in some formation following each other at a high rate of speed and possibly very high altitude from southwest to northeast and also one large orb type object moving to the south west.  The altitude could not be predicted in the night sky but there were no normal aircraft lights.  I also called a friend miles away that confirmed the sighting that my wife and I witnessed
774,4/13/20 20:11,Rio Rico,<br/>,Formation,Series of lights identified in Santa Cruz County Arizona
775,4/13/20 20:00,Lincolnton,GA,Light,My grandparents saw about 30 ufos last night all in a line at the same distance apart
776,4/13/20 19:30,Neptune,NJ,Disk,"Bright light that hovered for hours, resembled a very bright star."
777,4/13/20 19:15,Franklin,TN,Other,"while looking up at the stars last night, 6 of them began moving in straight lines, hundreds of miles in lenghth, vertically, then horizontally, the right angled turns impossible to make with known aircraft."
778,4/13/20 19:15,Tumwater,WA,Light,Illuminated Multicolored light formation with a  vague white background
779,4/13/20 19:10,Gilbert,AZ,Sphere,"Bright white light changing to pulsing colors and then red moving at high speeds, eventually splitting into two objects."
780,4/13/20 15:55,Millerton,PA,<br/>,MADAR Node 104
781,4/13/20 13:00,Burien,WA,Other,"Looked out my deck toward shorewood beach and saw a black shaped boomerang come out of water with a man in a suit of some kind hovering below craft.  Boomerang looked to be black transparent and was floating like a balloon up ,almost like gently then speed of tremendous speed up to the west was gone wierd ,looked like it was cloaked."
782,4/13/20 12:11,Newburgh,IN,<br/>,MADAR Node 142
783,4/13/20 11:56,Wichita,KS,<br/>,MADAR Node 123
784,4/13/20 05:55,Oakley,CA,Sphere,Multiple orbs witnessed flying in formation .
785,4/13/20 05:30,Central Point,OR,Light,unidentifiable lights in great numbers flying in a spaced out formation in the early morning sky
786,4/13/20 04:00,Tonopah,AZ,Light,"Small white, unblinking lights moving silently across sky"
787,4/13/20 03:31,SeaTac,WA,Light,Bright lights moving in a clockwise manner were observed at 3:30am
788,4/13/20,In Space (from the ISS),<br/>,Cigar,Pill like object seen from the ISS picture
789,4/12/20 23:50,Elk River,MN,Light,Was driving home towards Elk River from St. Paul area around a quarter to 11pm.  We are currently under Shelter in Place order
790,4/12/20 23:00,Bandon,OR,Fireball,It was 10:00 at night and I Was walking to my tent and notice the stars wear out and looked at one that was glowing brighter then any star I've seen before in my life but wen my eyes focesed clear enough to see a circle like a clock with the hands of time spinning  really really fast and my phone is not good enough to pick up the stars att all but at the same time it looked like a astroid or a fire ball from Mario not quit shuur but it got my attention
791,4/12/20 23:00,Danville,CA,Sphere,Large flashing yellow Orb Triangle
792,4/12/20 22:35,Wellington,FL,Circle,3 big white lights on v shape formation heading south 190.  No sound and you can see them through the clouds.
793,4/12/20 21:40,Montgomery,TX,Light,Blue orb emitted loud sound and disappeared in five seconds.
794,4/12/20 21:30,Universal City,TX,Sphere,"Three hovering, glowing orbs observed in sequence."
795,4/12/20 21:13,Emory,TX,Light,Objects that looked like a Satellite that moved in a straight line and disappear. About 35 + lights that moved
796,4/12/20 21:00,North Bergen,NJ,Unknown,snake shape bright light
797,4/12/20 21:00,Coronado,CA,Light,Two parallel lights (white) flashed red and white when I waved at the craft.
798,4/12/20 20:13,Las Vegas,NV,Fireball,Orb like fireballs
799,4/12/20 12:00,Montgomery,AL,Sphere,Fast moving soundless white sphere
800,4/12/20 11:26,Whately,MA,<br/>,MADAR Node 67
801,4/12/20 11:14,Boise,ID,<br/>,MADAR Node 111
802,4/12/20 09:38,Lad Cruces,NM,Circle,"I live at((deleted)) in Las Cruces NM, 88012. We have large, flat desert area where neighbors are acres apart. On this night I seven or more ( seven that I counted while outside smoking a cigarette) circular lights moving across the sky. They moved at their own speed, moving slowing then a little fast then stopping Before continuing again. They did this in the West side of the sky opposite of the organ mountains in Las Cruces NM, towards the small mountainin range in the east,the hot springs I believe, they moved like that until they were under what I would consider the north star, the brightest star in the sky I can see with the dipper south of it, and as they did they brightened, then moved faster between two stars to the right exactly parallel from each other and shot bright then disappeared. I have an albino German Shepard, his name is Clifford, he was outside and howling at the time this was happening and after I stopped seeing lights and what lo! oked like ships jumping to light speed, he stopped and came and sat next to me, not moving, when usually he can't refrain from jumping on me and my wife. This happened many times.. within literal seconds of the next light. One. Two. Three, four lights and on and they moved, then got bright, then shot across the sky and disappeared. This happens all the time here though. You guys really need to look here. We're like.... A major source and no one even knows it. They dart around these sky's nightly and if I had better equipment I would show you. Please send me a response, as I look forward to collaborating with you."
803,4/12/20 07:07,Newington,CT,<br/>,MADAR Node 106
804,4/12/20 06:34,Woodbine,GA,<br/>,MADAR Node 154
805,4/12/20 05:33,Oregon City,OR,Light,"East to West dozens, one after a other, lined up and at times multiples side to side, grid pattern, lights moving through the air.  No sound.  During COVID19 when flights are grounded, except military.  I've got video showing part of this."
806,4/12/20 05:30,Graham,WA,Other,"Taking dog outside.  Looked up and saw a long line of single almost evenly spaced bright white lights moving across the sky.  No sound.  No shape, headed ESE direction"
807,4/12/20 05:20,Ferndale,WA,Light,Line of lights (like satellites but many!)
808,4/12/20 05:15,Longview,WA,Unknown,Long period of flashing lights traveling in a signle file line formation.
809,4/12/20 05:00,Cloverdale,OR,Circle,"50 Moving Lights over the ocean at Cape Kiwanda, OR"
810,4/12/20 05:00,Canby,OR,Formation,Fleet of 39+ Flying White Dot's
811,4/12/20 05:00,Surrey (Canada),BC,Circle,"This morning around 5 am i was smoking out i noticed at first 3 lights flying above me at slow speed.  Then i noticed 8 more behind them all same speed and distance.  Bright round light, then i noticed 3 other objects in a triangle formation behind other objects.  I kind of afraid so i called my daughters bf to look at the sky. we noticed more in a straight line behind i would say 14 - 15 objects already.  He said those are planes. I express how is that possible too many one after another and no sound.  I have heard planes flying greater heights many times before and i can clearly hear engine roaring.  This group of objects make any sound. He left but i continued to keep watching, when i notice approximately another 5 behind the 15 - 16 except 1 object flow in a different direction north west same speed. The others were going the same speed same distance apart all the same size heading from south towards north east. I started thinking they possibly maybe be satell! ites. But i started feeling scared at that point and went inside.  After 20 minutes or so i was curious if the objects were still visible.  Unfortunately the sky was brighter and could see any more lights or objects.  Hopefully others witness this event this morning.  What i did realized is the speed they all were traveling is same as plane normally except the absence of sound.  Last thoughts is why would 30 or more planes be flying in that formation??  I wished i continued watching!!"
812,4/12/20 04:30,Eigene,OR,Formation,"4:30 AM I observed what I thought a satelite. I watched it cross the sky at satelite pace; traveling N.W. to S.E another appears same path.  Then comes 2 parallel to each other, then a single.  I watched for for an hour before it ceased."
813,4/12/20 02:45,Oakley,UT,Light,Bright light shined in bedroom window illuminating the room removing shadows before shrinking to a single point and disappearing.
814,4/12/20 02:00,Miami,FL,Changing,Red-Orange fireball over Miami
815,4/12/20 01:00,Phoenix,AZ,Other,Star looking ufo in sky starts to move then dim out and get brighter
816,4/11/20 22:30,Perth Amboy,NJ,Light,"The object was bright white at times stem like branches, object moved in various vertical and horizontal movements very slow."
817,4/11/20 22:15,Rincon,GA,Cylinder,We saw 2 cylindrical objects move through the sky in an odd manner. It could not have been a plane or a comet.
818,4/11/20 22:00,Ellington,CT,Light,30+ lights moving in formation moving across Ellington sky!
819,4/11/20 22:00,Malden,MA,Circle,I see and film rotating circular lights out through my window towards the South East horizon.
820,4/11/20 22:00,Wilmington,OH,Sphere,"Went outside to look at a plane flying over our area we had been tracking on a flight radar app, caught eye of 1st orb and considered the possibility of it being a simple satellite, then 16 more followed one after the other with about 3-5 seconds in between them coming into view.  They did not appear on this radar app therefore it is not a typical flight.  After flying through a small cloud they never re appeared again.  No sound, no navigation lights."
821,4/11/20 22:00,Oxford,OH,Light,Light moving.
822,4/11/20 21:30,Kennewick,WA,Circle,Two objects chasing each other around night sky
823,4/11/20 21:20,Vancouver,WA,Unknown,Strange light above washington that doesn't move at all
824,4/11/20 21:09,Quakertown,PA,Circle,Same as previous report second sighting of same object
825,4/11/20 21:05,Hanceville,AL,Light,"13 lights, straight trajectory, 30 sec apart, then disappeared."
826,4/11/20 20:30,Ansonia,CT,Cigar,"Sigle line formation one by one going towar the same directions, after zig zag formation. After desapear"
827,4/11/20 20:28,Las Vegas,NV,Oval,"This is my 3rd report. It’s been in the sky for 5 days now and I’ve had no contact or confirmation from any of ur staff.  I have binoculars and can describe it perfectly.  This is too strange to ignore.  Don’t u have contacts here to confirm my reports?  I recommend u contact the Air Force bade here,  Nellis to get someone to take this seriously.  My girlfriend has been with me all 5 nights this craft has been here.  She believes it’s one of ours, LOL. Pls do something!"
828,4/11/20 20:25,Natick,MA,Light,16 lights (like stars) making a line flying over Natick Massachusetts
829,4/11/20 20:15,Bourne,MA,Light,Series of lights moving west to east over cape cod
830,4/11/20 20:00,Junction City,OR,Sphere,"Looked metallic gray and was tilted at about a 45 degree angle, bottom visible."
831,4/11/20 16:00,Medford,OR,Oval,"Pinkish reddish, shape was oval, hovered"
832,4/11/20 13:09,Littlerock,CA,<br/>,MADAR Node 56
833,4/11/20 10:04,Monroe township,NJ,Circle,There was an inner red light with a larger outer blue light that was much taller
834,4/11/20 09:45,Spiceland,IN,Light,Lights crossing the night sky one after another... Then disappearing.  All in a straight line but a different heights.
835,4/11/20 09:15,Byron,NY,Light,Watch 1 object move drifrent directions at a speed that no air craft could possibly do.
836,4/11/20 01:30,SÃO PAULO (Brazil),<br/>,Light,Two vertical red lights in São Paulo city centre with explosive sound
837,4/11/20 00:58,Frackville,PA,Cigar,This was the best encounter.
838,4/11/20 00:30,Patterson,AR,Circle,"Saw five round crafts, six lights on bottom and one red light on center of bottom."
839,4/11/20 00:07,Woodland,CA,Circle,Ring camera caught object hovering and flying away.
840,4/11/20,<br/>,<br/>,<br/>,Bright orange air craft flying in a V and then a t shape pattern as they joined up and flew quickly out of my range.
841,4/10/20 23:15,Pleasant City,OH,Light,Bright Stationary light seen that last for over an hour.
842,4/10/20 23:00,Clifton Heights,PA,Light,Strange clusters of hovering white lights sometimes 3-5 of them seen nightly in the sky in Delaware County PA
843,4/10/20 22:50,Vukovar (Croatia),<br/>,Light,"10.4.2020 I went smoke outside then I saw light on the sky above Vukovar.  At first light had weak shine and it was moving, when it reached another light that looked like star, then light started to shine brighter. Then another light started moving parallel in north east direction. Over time lights had weak and reddish shine until they dissapeard."
844,4/10/20 22:20,Portland,<br/>,Light,"2 lights (white with slight amber pulses)  moving swiftly, turning suddenly and sharp. In sw sky in Portland Oregon"
845,4/10/20 22:15,Clifton park,NY,Circle,Bright circle hovering over Clifton park
