,datetime,city,state,shape,comment
0,4/30/20 00:00,Thibodaux,LA,Light,"14 Objects in a row, one behind each other  and watch one by one disappear."
1,4/30/20 23:49,Saint Petersburg,FL,Other,There were three dots in a straight line slowly moving for a while then boom vanish!
2,4/30/20 22:43,Edgewood,WA,Unknown,"Location of sighting: Edgewood, WA Date: Thursday April 30th Time: 10:43 PM Weather conditions: clear and other stars visible  On Thursday April 30th I was walking my dog at 10:43 PM in front of my house when I looked up at the night sky in a southwest direction and almost parallel to the moon I saw a light moving in the northwest direction at airliner speed.  I focused on this light and saw it pass between two dimmer lights that I thought were stars."
3,4/30/20 22:30,Vergas,MN,Light,White moving light
4,4/30/20 22:00,Calgary (Canada),AB,Disk,"At approximately 10:00pm, I spotted a large white light in the sky,  it was very bright. I went outside to inspect it further and the light dimmed gradually.  Two small red and green lights were visible on either side of this disc when the bright light dimmed.  The disc slowly moved across the sky in a straight line, making no noise . It was absolutely a UFO of some kind.  It then disappeared."
5,4/30/20 22:00,Tavares,FL,Formation,Fast moving formation of 20+ objects flying 2 abreast
6,4/30/20 22:00,Jacksonville,FL,Light,"Looked like stars, could have been satellites, but 50?"
7,4/30/20 22:00,Lincoln,AL,Other,Lights moving across the night sky
8,4/30/20 21:43,Miami,FL,Unknown,Hovering bright light
9,4/30/20 21:35,Montverde,FL,Unknown,"My wife was taking the garbage down around 9:20 p.m., she ran back to tell me to come outside quickly. Up in the sky moving West to East was a straight line of what appeared to be air craft of some sort. Each craft had only one single bright white with the exception of two that I saw. Those two craft had 2 lights on them in a straight line from West to East in the direction of the flight path. The last two craft were side by side bringing up the rear and they all disappeared shortly after passing overhead at or near 10 o’clock in the sky. There was no sound and no flashing indicator lights like you would see on commercial aircraft. The speed seemed to be much much faster then that of a commercial air line also. The parade of light were spaced equally in a straight line and lasted for almost 5 minutes with what we guess was 30-50 air craft. In the final few minutes our neighbor came out and witnessed the objects as well. We did try to capture a photo but they! did not come out."
10,4/30/20 21:30,Redmond,WA,Light,long string of moving lights
11,4/30/20 21:30,Jacksonville,FL,Light,There were 10-20 Star-like figures gliding across the sky in unison.
12,4/30/20 21:30,Davie,FL,Formation,6 craft line formation over south Florida
13,4/30/20 21:25,Jacksonville,FL,Unknown,Lights moving astronomically fast around the sky they stopped moving and stood still for about 15 seconds and then zoomed off
14,4/30/20 21:25,St. Cloud,FL,Formation,Just outside and looked at the sky and there was a line of UFOs about 15 to 20 objects. They also passed over the moon but I could not see any other shape of form.
15,4/30/20 21:23,Tampa,FL,Circle,At least 20 circular objects flying in a straight line at the same speed. Every few there was 2 lights instead of 1 flying together. Traveling North to South towards Macdill AFB.
16,4/30/20 21:20,Deland,FL,Light,I went outside look straight up in the sky and there was A-line of lights moving a cross the sky.  They were moving North to South In a straight line they would appear About a quarter off the horizon North and disappeared about a quarter off the horizon South.  Some were only a single light but some had a light next to it just behind it trailing.  They were also solid lights no flashing lights seen.  I have a friend that lives about a 100 miles away from me and he went outside and looked up in the sky and saw the same thing.  I couldn't get any video because it was too dark but I do have 4 pictures.
17,4/30/20 21:20,Jupiter,FL,Formation,string of lights
18,4/30/20 21:20,Honolulu,HI,Unknown,I was shootimg darts in my carport and saw a military helicopter flyer way faster than usual.  As it get closer to land i niticed a white light in front of it going at the exact same speed and stayed directly in feont of the chopper.  As a veteran and living here in HI I've seen tons of military helicopters and can even hear the rotor difference from inside of the house.  I've never seen one fly so fast over the east side and looked like it was chasing the solid white object.
19,4/30/20 21:15,Fort Myers,FL,Rectangle,"Clear night, looking at the moon and stars, from the North came a line of line of lights 7 in front, 5 in the middle, and another 6 or 7 behind, they came from the North high in the sky, to the right of the moon, all in a straight line,heading to my left,  I got the middle group on camera, they went in a straight line under the moon and as they continued to my left they disappeared into the atmosphere.  What caught my attention is that they were all in a straight line and no sound was detected. Then just disappeared."
20,4/30/20 21:15,New Smyrna Beach,FL,Light,Numerous lights flying across the sky in a straight line and equidistant
21,4/30/20 21:15,Brooksville,FL,Light,"Long string of 24+ equally spaced lights moving across the sky from North to South in Brooksville, FL."
22,4/30/20 21:15,Coconut Creek,FL,Formation,Dots of light in a line formation slowly moved in a southwest upward motion and each disappeared as it looked to be going upward.
23,4/30/20 21:15,Coral Springs,FL,Light,"It was a consistent line of moving lights evenly spaced, whereas halfway through the sky each one disappeared as each one appeared  out of nowhere. No sound."
24,4/30/20 21:10,Saint Augustine,FL,Light,20 plus lights in single file. About 5 minutes viewing. Last 2 lights were side by side.
25,4/30/20 21:09,Des Moines,IA,Disk,hovering saucer nears ground then disappears in sky
26,4/30/20 21:05,Titusville,FL,Light,Objects look like stars but moving fast in one line
27,4/30/20 21:00,Seabrook,TX,Formation,19 fast flying silent UFOs in formation
28,4/30/20 21:00,Palm Bay,FL,Light,15 plus lights traveling in perfect straight line. Appeared as bright as a star.
29,4/30/20 21:00,Ocala,FL,Light,"I went out to smoke i always watch the sky when i seen 6 white lights high in the sky flying 2x2 with 1 in the front lasted for about 10 to 15 seconds ran in to get someone to witness it they were gone.  So i kept watching the sky then see 2 more white light side by side about 20 minutes later then about 10 minutes later seen 1 more whote light then about 5 to 10 mins later seen another white light those stayed lit until they were to far to see anymore.  They were very high in the sky not like a meteor or plane or copter.  They looked like stars looks just as bright the lights didnt flicker just stayed bright until they were to far to see anymore.  I tried to get a video, but my phone wouldnt pick it up."
30,4/30/20 21:00,Dover,FL,Light,String of lights in Tampa Bay area
31,4/30/20 21:00,Coral Gables,FL,Light,I was running around the golf course in Coral way when a couple stopped me and told me &quot;Am I crazy or those lights are moving?&quo
32,4/30/20 20:50,Baton Rouge,LA,Formation,Line of light moving across the sky
33,4/30/20 20:15,Clermont,FL,Cigar,I was taking the trash out and turned around towards my house and saw 20+ bright lights cross the sky to the West below the moon.  Most were in a straight line one behind the other.  However several were beside one another.  They were moving very fast and once they were to my left they were suddenly gone.  I could tell they were not planes of any sort because they didn't flash and were too close together.  I tried to take a video with my cell phone but onlt got a picture of on of the lights.
34,4/30/20 20:10,Truth or Consequences,NM,Circle,"Was visible to the north.  Two large circular red lights.  Moved from east to west.  Both lights appeared and then they moved west one over the other replacing each other.  And then both light appeared again.  Then dissapeared.  Not a slow disappearance.  It was immediately gone.  After staring at the sky all my life, this was my first legitimate ufo sighting ever.  The red colored lights were not typical, more of a neon red."
35,4/30/20 19:50,Roseburg,OR,Oval,"We were driving and had to pull over, craft was moving slowly, was as white as light, we watched it zig zag slowly and then disappear over a mountain."
36,4/30/20 19:00,Pleasant view,UT,Sphere,My girlfriend and I were hammocking in my back yard when we saw something we first thought was a weather ballon then changes shape into a sphere and started moving very sporadically and very suddenly went into a spiral and disappeared in a very clear blue sky.  Within this time it appeared and reappeared about two times. It also had a slight haze around it as if it was emoting a glow.
37,4/30/20 17:00,Micco,FL,Light,"10-12 objects flying or moving symmetrically, moving south!  All objects looked like stars!"
38,4/30/20 17:00,Vancouver,WA,Circle,"Saw 'white orb swarm' of 10-20 during the day, near Columbia River in Vancouver,  WA on 4/30/20."
39,4/30/20 14:30,American Fork,UT,Changing,Stationary bright silver object hovering over mountain then vanished out of sight.
40,4/30/20 14:22,American Utah,UT,Light,Picture of the same UFO that they filmed at Skinwalker Ranch.
41,4/30/20 13:13,Cottonwood Heights,UT,<br/>,Hill AFB just did the Covid flyby to support our first responders.  Took this picture on Fort Union Blvd. looks like a foo fighter above and one below.  I also have video.
42,4/30/20 11:30,San Diego,CA,Formation,Three objects in exact formation
43,4/30/20 09:17,Davie,FL,Light,Backyard UFO Fleet night sky sighting!
44,4/30/20 09:17,Orlando,FL,Circle,There was circular lights flying in a straight line crossing the moon and were also above planes they went from Northwest to Southeast
45,4/30/20 09:14,Tifton,GA,Light,30+ dots of light flying ons behind the other in a straight line heading south east.
46,4/30/20 03:28,Boise,ID,<br/>,MADAR Node 111
47,4/30/20 03:15,Clearwater,FL,Other,Got up to 3:15am was attracted to look at a “star like” that suddenly went to a blinding bright envelope of bright light.
48,4/30/20 02:30,Bloomington,IL,Light,Spotted an indigo light to the east of the city. encounter lasted roughtly 15 minutes.
49,4/30/20 00:11,El Paso,TX,Unknown,"It was around 12:11 in the morning and I was just hanging out in my backyard with my dog.  I saw an object flying very low, around 100 or 200 feet in the air at extremely high speeds.  It couldn't have been a plane because it had no wings and I dont live near an airport and it couldn't have been a helicopter because it had no propeller.  The lights were white, red and green.  It was a rectangular shape in the back and a triangular shape in the front.  It seemed to have a headlight in the middle of the triangular shape at the front, kind of like some kind of weird flying train.  It was a carbon black color.  I would like to note I live very near the location of the famous roswell and also im not to far from elephant bute which also has many reported sightings of ufos."
50,4/30/20 00:11,Pueblo,CO,<br/>,MADAR Node 83
51,4/30/20,Pompano Beach,FL,Oval,I was looking to the West and all of a sudden by I think the planet Venus???  There was 12 lights flying parallel in a straight line for about 10 minutes.  I had no idea what was going on but a friend of mine saw it too.
52,4/29/20 23:55,Tulsa,OK,Circle,Object appeared Southwest moving very very quick to the northeast.  After the object made it a ways to the northeast it turn quite abruptly what appeared to be straight north.  The object was not reflective like a satellite would appear to your eye.  It looked as if it was just outside of our atmosphere.  It had a Orb like look the light I could see appeared to be circling the object.I didn’t hear any sounds like a aircraft.  Never seen anything like it and when it turned it blew my mind
53,4/29/20 23:35,Banning,CA,Light,Driving down a dark road we spotted a helicopter chasing a light at high speeds
54,4/29/20 23:20,Citrus Heights,CA,Light,2 star objects appear then disappear while moving vertical into the sky.
55,4/29/20 23:00,Midland,TX,Sphere,Second sighting in 1 week.  Strait line.  Very high speed.  Side observer also in sphere. Moving over 7.500 MPH.  Saw by neighbor and us.  Second sighting different directions.  The formation deviates.
56,4/29/20 22:30,Kelowna (Canada),BC,Cone,Space station like object looks like it’s continuously on a loop only seeing one object at a time 10 of them seen. BC Canada
57,4/29/20 22:00,Cape Coral,FL,Light,Light moving sporadically over SW Florida coast
58,4/29/20 22:00,Fort Jones,CA,Light,First noticed a very bright light hovering in the sky.  Then noticed some star like lights moving through the sky and then ascending up until out of sight this continued for over an hour. some moving together some one at a time but eventually all ended up ascending up into the clouds out of sight meanwhile the original bright light drifted off until it was also out of sight. seemed like every time they moved shortly after the wind would pick up they were never in any type of formation and never had any trail of lights following them.  just looked like blinking stars
59,4/29/20 22:00,Fort Jones,CA,Light,"Multiple &quot;star&quot; like lights moving throughout night sky, then ascending into sky"
60,4/29/20 21:40,Geneva,FL,Light,"We saw 50+ dots of light traveling in perfect unison one after the other, appearing in one spot and disappearing in another."
61,4/29/20 21:40,Port Saint Lucie,FL,Oval,Several lights in a straight line and then disappearing above the stars.
62,4/29/20 21:30,Woodbury,GA,Light,String of tiny lights in sky approx. 50 to 75 in single file straight line extremely high up.
63,4/29/20 21:30,Salem,OR,Light,My mom woke me up around 9:30 ish and told me to &quot;come look at this ufo hurry.&quot; Went outside and it looked like a super brigh
64,4/29/20 21:30,Vero Beach,FL,Light,While fishing on the Indian River near Johns island 30-40 lights were observed heading north to south evenly spaced then disappeared when they hit a certain point
65,4/29/20 21:25,Los Angeles,CA,Fireball,"Bright, orange/reddish light spotted moving over East LA"
66,4/29/20 21:25,Mount Pleasant,SC,Formation,We saw 6 lighted objects moving in a straight line towards a dimmer light and then disappeared.
67,4/29/20 21:15,Ponte Vedra Beach,FL,Light,Fleet of 30 crafts traveling in a row
68,4/29/20 21:00,Birmingham,AL,Circle,"As i was outside in my driveway,there was about 20 &quot;Crafts&quot; in the sky moving at a fast rate in a single filed line,one after"
69,4/29/20 20:45,Richmond,TX,Diamond,I was outside just relaxing looking at the stars when i noticed a straight line of stars i thought then i noticed they were moving in perfect formation heading towards southwest i called my sister who also confirmed what i saw and they continued moving for about 2 minutes maybe 25 to 30 of them evenly spaced very weird very scary makes you think thats why I'm here
70,4/29/20 20:40,Murfreesboro,TN,Formation,Straight line formation of 30 objects
71,4/29/20 20:35,Waynesboro,TN,Unknown,"I stepped outside to look at sky and saw a fast moving star light object and small sized object moving rapidly across the sky ( which I have seen on multiple occasions and have understood that to be a satellite !  But then there were two three four and more , at least 20-25!! Perfectly spaced traveling high velocity in tandem in perfect alignment heading north East across the clear sky! Very strange and unnerving !"
72,4/29/20 19:18,Melbourne,FL,Light,Line of traveling white lights disappear one by one over Melbourne FL.
73,4/29/20 18:34,Fayetteville,AR,<br/>,MADAR Node 136
74,4/29/20 16:45,Holt,FL,Rectangle,Witnessed oblong metallic object sit motionless in sky for 30 seconds before slowly flying away.
75,4/29/20 16:00,Tacoma,WA,Diamond,"At approximately 4:20AM in Tacoma,Wa I went outside and looked up to see a whole fleet of UFO's all flying in a straight line, looked to be equally spaced each one flying into a large dark cloud."
76,4/29/20 09:45,West Jordan,UT,Cylinder,"I was walking northbound and observed a white light (much like Venus in brightness) slowly travelling both and a very slowly speed.  I guess the approximate altitude about 20,000 feet. The object moved north and hovered in one spot for the duration of the sighting. It appeared to the naked eye as a small bright white light.  When I viewed it through binoculars, the shape was cylindrical with two small cylindrical objects the the each side. Half the the length of the main object.  It was grey in color and the two objects on the side are either engines or reflectors."
77,4/29/20 06:00,Covington,KY,Circle,2 spheres about a foot apart colliding together and back apart.
78,4/29/20 04:15,Frostproof,FL,Light,I saw a very bright very green light descend over Lake Clinch.
79,4/29/20 03:18,Santa Fe,NM,<br/>,MADAR Node  78
80,4/29/20 00:45,Carson City,NV,Sphere,Bright Object jumping back and forth in sky followed by 3 star like diagonally lined object hovering in the sky
81,4/29/20 00:30,Ewa Beach,HI,Light,"White light, with orange trails on each side."
82,4/28/20 00:00,Hammonton,NJ,Formation,"The light were in formation, nothing like i ever seen in my life.they travel very fast in single line in the sky traveling from the west to the east.. i mean it was a view and all in one line . Crazy nothing  like i ever seen . No trails no flashing light like our aircraft have i counted 25 and its unbelievable all in straight line symmetrical i never seen anything like this ever"
83,4/28/20 23:20,Trafalgar,IN,Circle,Helicopter chasing red large round object in the sky.
84,4/28/20 23:15,Courtenay (Canada),BC,Light,"I watched them go by, they seem to be approximately the same distance apart. In a line. They were bright steady lights. Moving quite fast . Just plain white light"
85,4/28/20 23:00,Yerevan (Armenia),<br/>,Triangle,"3 red dot lights keeping their triangle shape and spinning in circles, i saw this while i was smoking outside on my balcony,my apartment is at the roof"
86,4/28/20 22:10,Wilmington,NC,Unknown,"10 white lights in formation, observed over Wilmington NC."
87,4/28/20 22:00,Taylors,SC,Formation,String of lights formation.  Traveling west to east.
88,4/28/20 22:00,Millington,TN,Light,"Bright singular light hovering, disappearing, then reappearing in minutes"
89,4/28/20 22:00,Belton,SC,Circle,We saw (what I counted) 12 round orbs following one another at an exact distance from one another in a straight line across the sky at a very fast pace.  We first thought they were stars but due to the speed we realized they were traveling very very fast.  Then one after another they started to vanish.  We tried to record or take pictures with our phones but they weren’t strong enough to capture the images in the dark sky.
90,4/28/20 21:58,Iowa Park,TX,Light,"Last night I stepped out on porch looked up North West direction and it looked like a string of white lights evenly spaced apart from my view began about the height of the telephone pole upward in a linear arched manner. The lights were moving in a line toward the half moon sitting due west of my home, then one by one disappeared into the darkness.  The skies were mostly clear few wispy clouds from few miles east of my home to the west.  However, east of this area was thunder storm lightning event that was moving south east. I’ve never seen anything like this before and was wondering if they were launching satellites or something.  Wish I’d had my phone out there with me.  I’m an educated person in the health field we live outside city limits slightly where ther a no city lights interfering with star gazing. I’m certain I’m not the only person to have observed these lights it was extraordinary it caught my eye.  I’ve never seen or reported anything like this before.  You may contact me if needed/confirm if others saw these lights too."
91,4/28/20 21:49,Kamay,TX,Light,I saw a line of about 8 to 10 star-like looking objects. They were moving in an upward angle towards south.  ((Starlink satellites??)
92,4/28/20 21:45,Iowa Park,TX,Formation,19 starry objects in a line vanish.
93,4/28/20 21:45,Lawton,OK,Formation,Linear light formation traveling east.
94,4/28/20 21:35,Leicester,NC,Formation,A string of fast moving lights moving rapidly from north to south.
95,4/28/20 21:30,Louisville,KY,Light,Numerous lights moving in a single file seen in the nighttime sky
96,4/28/20 21:30,Folly Beach,SC,Light,Approximately 40 white lights in a straight line moving from right to left all disappearing at a certain point.
97,4/28/20 21:30,Greensboro,NC,Formation,"23 unidentified flying objects in single file formation, flying at a high rate of speed."
98,4/28/20 21:30,Fordyce,AR,Light,Lights traveling
99,4/28/20 21:30,Richlands,NC,Light,lights evenly spaced traveling west to east. for aprox 15 min.
100,4/28/20 21:30,Elkview,WV,Light,5-6 star like objects in a straight line moving across the sky from west to south east
101,4/28/20 21:20,Wichita,KS,Formation,Saw a bunch of round bright lights in formation across the whole sky
102,4/28/20 21:19,Charleston,WV,Light,"Approximately 10 lights located high in the sky traveling simultaneously from northwest to Southeast,  lasting almost 2 minutes"
103,4/28/20 21:15,Boiling Spring Lakes,NC,Other,"Numerous objects, similar in size and brightness to stars at night, moving rapidly in a northwest  to southeast arc, then disappearing."
104,4/28/20 21:15,North Augusta,SC,Light,Long  string of lights traveling for south west to the north east.  Evenly spaced apart and traveling at the same speed. I saw about  40 or 50 but they were already  above and passing by when I noticed it.
105,4/28/20 21:09,Watsonville,CA,<br/>,MADAR Node 105
106,4/28/20 21:00,Mays Landing,NJ,Circle,30 silent bright lights moving fast in a row
107,4/28/20 21:00,Merrilville,IN,Light,UFO’s Might be Observing Elon Musk’s StarLink satellites!
108,4/28/20 21:00,Easley,SC,Light,50 light anomalies headed north east in PERFECT FORMATION AND SPACING apart.
109,4/28/20 21:00,Baltimore City,MD,Circle,Bright circular lights flying in unison
110,4/28/20 20:55,Scott’s Valley,CA,Chevron,"Large, dim, chevron shaped craft seen at night traveling north and accompanied by an oblong craft traveling very fast"
111,4/28/20 20:51,Newark,DE,Light,Lights moving evenly in single file at a fast pace.
112,4/28/20 20:50,Pueblo,CO,Light,Traveling lights over Pueblo
113,4/28/20 20:45,Medford,OR,Fireball,Flaming object traveling extremely quickly from east to west duration lasting between 3 and 8 seconds descended towards Jacksonville.
114,4/28/20 20:45,Cottonwood,AZ,Disk,"flew from East to West in straight line, flat circular object with dim white lights around edges.  Seem to become brighter and then vanished.  Appeared larger than commercial jet. Had no sound.  Very fast,visible for only 5 seconds.  Had no trail."
115,4/28/20 20:45,Beaverton,OR,Sphere,"Appeared out of nowhere, slighyly above the tree line, crossed over roadway, east to west. White ball of light, crossed quickly then speed away & disappeared. 15-30 seconds"
116,4/28/20 20:40,Salem,OR,Circle,"I was driving on Cordon Rd, from Ward Dr to State St when I saw it.  It was going perpendicular of my driving.  It was just below the clouds and was a light green color.  The even lasted a little less than 2 minutes, as it was moving along the underneath of clouds and eventually disappeared."
117,4/28/20 20:30,Albuquerque,NM,Light,UFO - Red light hovers over Sandia Mountain then at low it changes to two different colors and dissappears!!
118,4/28/20 20:30,Dixon,NM,Light,"A string of lights symmetrical in distance apart, moving quick across the sky and then fading away into the distance"
119,4/28/20 20:27,Tulsa,OK,Triangle,Photos of ufo hidden in cloud bank after thunderstorm.
120,4/28/20 20:26,Spencer,OK,Disk,"Me and my son went outside to smoke and when we looked up there was a single line of 13 saucer shaped disc headed east, there was no noise and then disappeared into the clouds."
121,4/28/20 20:10,Palmer Lake,CO,Light,"While at the park doing some sky watching there was a line of craft perfectly spaced traveling across the sky.  They seemed to be traveling in a large group. They were symmetric in shape.  They appeared to be very high up, defiantly higher than any combustion aircraft can fly.  No noise was produced by these craft.  Quiet and peaceful."
122,4/28/20 20:00,Hope Mills,NC,Formation,A perfectly straight line of bright lights were flying by overhead then ascended into outer space. Objects were perfectly quiet..Was in the Air Force and have seen every type of aircraft imaginable. Nothing like I've ever seen before!
123,4/28/20 20:00,Trinidad,CA,Disk,"Disk object seen flying at high rate of speed at low angle towards ocean.  Surrounded by huge flames.  Colored orange, yellow, blue, white.  Possible 10 or 20 foot long  flames.  Object was close to Trinidad rest area on Hwy. 101, North of Trinidad town.  Object appeared to be around the size of a small house, or perhaps two large school buses.  Seen by people at rest area."
124,4/28/20 18:00,Gresham,OR,Cigar,"Object was heading from east to west at an angle of descent.  Was moving fast, unit it vanished.  Entire object was lit up as a single light bright white.  From time of sight to time of vanishing was about 6 seconds and coving a great distance.  We were looking in south direction towards Walters hill from by Gresham police station.  There was no sound..."
